11/6/2022 20:39,11/6/2022 20:43,IP Address,50.216.25.75,100,286,TRUE,11/6/2022 20:43,R_9u8OyZtFStqe5EJ,,,,,39.7272,-121.8129,anonymous,EN,I am 18-years of age or older and I agree to take this survey.,11425883,11425883,Higher Education Policy,Strongly Agree,Agree,Strongly Agree,Strongly Agree,Strongly Agree,Strongly Agree,The Town Hall Meeting meant getting myself out of my comfort zone and just express how I feel about my Policy Area. It gave me self-growth on better preparing myself for what is happening around me and listening to others have the same thoughts as I was helpful. ,I think the checking-in part should have been better organized and the getting two stamps part was very difficult because there wasn't enough room for everyone.,I had to take this class as a requirement and I honestly thought it'd be interesting to get myself out of my comfort zone. 
11/6/2022 20:45,11/6/2022 20:50,IP Address,98.208.20.125,100,314,TRUE,11/6/2022 20:50,R_5hkVAUnTXWLvU6R,,,,,39.8068,-121.867,anonymous,EN,I am 18-years of age or older and I agree to take this survey.,11197122,11197122,Immigration Policy,Strongly Agree,Strongly Agree,Agree,Strongly Agree,Strongly Agree,Strongly Agree,It was a chance to get to share my views on my topic and see how others also felt about immigration policies. It helped me see that I was not alone in my thinking and  supported my thinking in how something should be done.,I feel that Town hall was fine just the way it was organized. ,I took this section without knowing what town hall was but I was excited to find out and overall it was an experience I enjoyed doing.
11/6/2022 21:02,11/6/2022 21:05,IP Address,132.241.174.52,100,212,TRUE,11/6/2022 21:05,R_vMHhjvXbX94mPx7,,,,,39.7458,-121.8444,anonymous,EN,I am 18-years of age or older and I agree to take this survey.,11466326,11466326,"Food, Agriculture, and Animal Policy",Agree,Agree,Strongly Agree,Agree,Disagree,Disagree,"It was kind of stressful. I didn't fully understand what I was doing when I started. It was also not easy when my THM Assignment would be graded after office hours, so then I could not get the help I needed before the assignment was due.",Examples of what to do when first starting. For the TA's to be on top of grading so then we can get help in time.,"I signed up for a required class, I didn't really know what I was taking."
11/6/2022 21:06,11/6/2022 21:13,IP Address,132.241.174.79,100,438,TRUE,11/6/2022 21:13,R_rd5Ir24ErRROANP,,,,,39.7272,-121.8129,anonymous,EN,I am 18-years of age or older and I agree to take this survey.,11612225,11612225,Climate Change and Environmental Policy,Agree,Agree,Agree,Agree,Agree,Agree,"It was fun, it seemed a little disorganized and rushed, but I definitely learned a little from my peers.","Make sure that the break out rooms actually exist, for example i was in Glenn 131, but glenn only goes up to 125 on the first floor.",I thought i might be fun to get more involved and rate my professor was good too. 
11/6/2022 22:08,11/6/2022 22:10,IP Address,132.241.174.132,100,156,TRUE,11/6/2022 22:10,R_3e5kh25P8H8vTAN,,,,,39.7458,-121.8444,anonymous,EN,I am 18-years of age or older and I agree to take this survey.,11518846,11518846,Housing and Homelessness Policy,Strongly Agree,Agree,Agree,Strongly Agree,Agree,Disagree,It meant I pass the class.,Informational video on how the event goes and making the event admission streamlined,
11/6/2022 22:29,11/6/2022 22:31,IP Address,132.241.174.42,100,124,TRUE,11/6/2022 22:31,R_2cCPZb36tielfRa,,,,,39.7458,-121.8444,anonymous,EN,I am 18-years of age or older and I agree to take this survey.,11456823,11456823,Immigration Policy,Agree,Agree,Agree,Agree,Agree,Agree,,,
11/6/2022 23:24,11/6/2022 23:26,IP Address,132.241.174.224,100,151,TRUE,11/6/2022 23:26,R_2qqr6oyFj4MzVME,,,,,39.7458,-121.8444,anonymous,EN,I am 18-years of age or older and I agree to take this survey.,11589982,11589982,Immigration Policy,Strongly Agree,Strongly Agree,Agree,Strongly Agree,Strongly Agree,Agree,,"I think maybe just more practice before hand was needed, to confidently discuss the topics",
11/6/2022 23:24,11/6/2022 23:28,IP Address,73.90.168.22,100,203,TRUE,11/6/2022 23:28,R_24dztVcYut3jOhf,,,,,39.7458,-121.8444,anonymous,EN,I am 18-years of age or older and I agree to take this survey.,10931909,10931909,Healthcare Policy,Strongly Agree,Agree,Agree,Strongly Agree,Strongly Agree,Strongly Agree,"Kinda felt like a new experience but, I felt like it was productive on discussing our own policy areas. ",Time wise kinda felt rushed a little ,required course 
11/7/2022 0:24,11/7/2022 0:31,IP Address,216.106.153.65,100,449,TRUE,11/7/2022 0:31,R_24ldC5V1AjJO535,,,,,39.7458,-121.8444,anonymous,EN,I am 18-years of age or older and I agree to take this survey.,10142536,10142536,Reproductive Health Policy,Agree,Strongly Agree,Agree,Agree,Agree,Agree,it was good for us students to discuss our projects and collaborate with others in the discussion ,have it be a multi day operation,for my major 
11/7/2022 8:41,11/7/2022 8:47,IP Address,172.58.39.116,100,374,TRUE,11/7/2022 8:47,R_1F4IFbMzu6IdQj0,,,,,38.6639,-121.3388,anonymous,EN,I am 18-years of age or older and I agree to take this survey.,11070606,11070606,Cost of Living and Poverty Policy,Agree,Strongly Agree,Agree,Strongly Agree,Agree,Agree,A way to find more about if my policy could actually be a thing one day.,Making smaller groups. 20+ people took too long to get through ,"It worked with my schedule to balance home, work, and school"
11/7/2022 9:02,11/7/2022 9:05,IP Address,73.41.210.61,100,195,TRUE,11/7/2022 9:05,R_2PuirYfblEBc2OK,,,,,39.8068,-121.867,anonymous,EN,I am 18-years of age or older and I agree to take this survey.,11389275,11389275,Immigration Policy,Agree,Agree,Agree,Agree,Agree,Agree,,"I don’t know if it’s something that can be improved per say, but definitely the long lines were an issue",I asked around from people who have taken both and I saw that people who took town hall enjoyed the class more so I decided to take it 
11/7/2022 9:23,11/7/2022 9:26,IP Address,132.241.174.62,100,150,TRUE,11/7/2022 9:26,R_2CUGVEFxoQZuYHq,,,,,39.7458,-121.8444,anonymous,EN,I am 18-years of age or older and I agree to take this survey.,11619895,11619895,Reproductive Health Policy,Strongly Agree,Agree,Agree,Agree,Disagree,Disagree,It was cool and informative but it was really unorganized at some parts and I tried asking what was going on and no one seemed to know,The part where we had to get the stamps ,I thought it would be more interesting and it was
11/7/2022 10:05,11/7/2022 10:09,IP Address,132.241.174.90,100,257,TRUE,11/7/2022 10:09,R_2TRXXJ7HShhQMSf,,,,,39.7272,-121.8129,anonymous,EN,I am 18-years of age or older and I agree to take this survey.,8702812,8702812,Climate Change and Environmental Policy,Strongly Agree,Strongly Agree,Strongly Agree,Strongly Agree,Strongly Agree,Strongly Agree,learning new information and hearing different points ,"remove the beginning  portion of lining up and watching those videos I felt that was a waste of time
","mandatory, and I wanted to learn new diverse opinions "
11/7/2022 10:09,11/7/2022 10:12,IP Address,132.241.174.84,100,190,TRUE,11/7/2022 10:12,R_pmkmr7cMyIvSBDX,,,,,39.7272,-121.8129,anonymous,EN,I am 18-years of age or older and I agree to take this survey.,11469199,11469199,Firearm Policy,Agree,Agree,Agree,Agree,Strongly Agree,Strongly Agree,"I think it was a melting pot of many different ideals and policies, in a good way.",There could be more open mindedness.,It was recommended by advisors at orientation. 
11/7/2022 10:09,11/7/2022 10:12,IP Address,132.241.174.111,100,206,TRUE,11/7/2022 10:12,R_2eb4uxTKRRmNzKb,,,,,37.9269,-122.3313,anonymous,EN,I am 18-years of age or older and I agree to take this survey.,11517767,11517767,Criminal Justice Policy,Disagree,Agree,Agree,Disagree,Agree,Disagree,"Town Hall was honestly mandatory and I was not looking forward to it, because it seemed intimidating. Though, I feel like I actually learned new things and I enjoyed hearing what others had to say. ",I would say maybe a little bit more organized. Also more clear instructions to the moderators because some of them didn't know to give us the handout. ,To cover my GE and I was more interested in this than history. 
11/7/2022 10:09,11/7/2022 10:19,IP Address,132.241.174.167,100,571,TRUE,11/7/2022 10:19,R_26hbTbv0DH7HBQs,,,,,39.7458,-121.8444,anonymous,EN,I am 18-years of age or older and I agree to take this survey.,11510227,11510227,Healthcare Policy,Agree,Agree,Strongly Agree,Strongly Agree,Disagree,Disagree,To me the Town Hall Meeting was just an event required to pass the class. ,I would improve the number of tables at the end of the event. ,I'm not sure. 
11/7/2022 10:58,11/7/2022 11:02,IP Address,132.241.174.247,100,218,TRUE,11/7/2022 11:02,R_2qsBgyIwFgV5Gv6,,,,,39.7458,-121.8444,anonymous,EN,I am 18-years of age or older and I agree to take this survey.,11339602,11339602,Housing and Homelessness Policy,Agree,Agree,Strongly Agree,Disagree,Strongly Agree,Agree,It was a culmination of all of the work I have been doing in this class. It was something I was able to be proud of doing.,"It was really crowded at parts, and disorganized in some areas. It started late and our time was cut short. It's also very late, running all the way until 9-10 is too much.",I was not aware there weren't non Town Hall sections.
11/7/2022 11:25,11/7/2022 11:28,IP Address,132.241.174.83,100,157,TRUE,11/7/2022 11:28,R_1FaFvCjOLKJqogR,,,,,39.7272,-121.8129,anonymous,EN,I am 18-years of age or older and I agree to take this survey.,11371257,11371257,Cost of Living and Poverty Policy,Agree,Agree,Agree,Agree,Agree,Agree,It meant a bunch of students who had different ideas of how to help others affected by our policy issue. ,More organized!,I wanted to learn about our local government.
11/7/2022 11:47,11/7/2022 11:49,IP Address,76.127.68.220,100,127,TRUE,11/7/2022 11:49,R_2tlLMczqKhz0mwE,,,,,39.7458,-121.8444,anonymous,EN,I am 18-years of age or older and I agree to take this survey.,10592479,10592479,Climate Change and Environmental Policy,Agree,Agree,Strongly Agree,Agree,Agree,Agree,Information to make an impact,Check ins,To explore my options on how a student can make political change
11/7/2022 11:55,11/7/2022 11:58,IP Address,132.241.174.243,100,172,TRUE,11/7/2022 11:58,R_31WAgkfItydkm4L,,,,,39.7458,-121.8444,anonymous,EN,I am 18-years of age or older and I agree to take this survey.,11368059,11368059,Criminal Justice Policy,Agree,Agree,Agree,Agree,Agree,Agree,I was an opportunity to talk about ways to have my policy solution implemented into society. It was also to learn about other peoples solutions and obstacles. ,The check in process.,It fit into my schedule.
11/7/2022 12:32,11/7/2022 12:34,IP Address,132.241.174.246,100,118,TRUE,11/7/2022 12:34,R_1LzIqxIaUcZOWyS,,,,,39.7458,-121.8444,anonymous,EN,I am 18-years of age or older and I agree to take this survey.,11179273,11179273,Housing and Homelessness Policy,Strongly Agree,Agree,Agree,Agree,Agree,Agree,,,"town hall assignment number 6, a pen, pencil and a jacket "
11/7/2022 12:33,11/7/2022 12:43,IP Address,132.241.174.132,100,601,TRUE,11/7/2022 12:43,R_3JgZ2o3GagjnEp1,,,,,39.7458,-121.8444,anonymous,EN,I am 18-years of age or older and I agree to take this survey.,11129951,11129951,Immigration Policy,Agree,Agree,Agree,Agree,Strongly Agree,Agree,"First, those are just dummy events. I didn't want to attend it, but I wanted to pass the class. After Town Hall, I wasn't that bad; I loved it. ","Dress code, everyone dressing professionally. ","To Pass the Class and GE requirements, since I'm a History major, I love the class, and the History I'm into is US History. "
11/7/2022 12:55,11/7/2022 13:03,IP Address,71.195.162.8,100,471,TRUE,11/7/2022 13:03,R_3nkklhPYlIL1p2L,,,,,39.8068,-121.867,anonymous,EN,I am 18-years of age or older and I agree to take this survey.,10726834,10726834,Housing and Homelessness Policy,Strongly Agree,Agree,Agree,Agree,Strongly Agree,Strongly Agree,Being a college student and seeing the problems facing our community sometimes you feel like you can't do anything to make change. I think town hall is a good experience because it gives students ideas of how to make changes to their community and that it is easier to organize than one might think,"The checking in portion before the event started took a lot longer than I thought it would. The action imposium thing seemed kind of rushed because a lot of the students just wanted to get out of there, maybe having incentives for people to stay there and actually listen might help",I had previously taken POLS155 during the online year but didn't do too well on it. I decided to retake it. I felt like actually having the town hall in person was a much better experience.
11/7/2022 13:06,11/7/2022 13:08,IP Address,76.137.148.156,100,107,TRUE,11/7/2022 13:08,R_3NKSwg6J0DoGXT4,,,,,39.7272,-121.8129,anonymous,EN,I am 18-years of age or older and I agree to take this survey.,10659559,10659559,Cost of Living and Poverty Policy,Agree,Agree,Agree,Agree,Agree,Agree,It was nice to share the thoughts of the research I have been collecting the whole semester.,,Requirement
11/7/2022 13:04,11/7/2022 13:08,IP Address,132.241.174.57,100,229,TRUE,11/7/2022 13:08,R_2S2ho6cZxU4g6OA,,,,,39.7458,-121.8444,anonymous,EN,I am 18-years of age or older and I agree to take this survey.,10918480,10918480,Climate Change and Environmental Policy,Agree,Strongly Agree,Strongly Agree,Strongly Agree,Agree,Agree,I enjoyed hearing other students ideas for ways to help with our changing climate. I also liked being able to talk to consultants who know how we can start to implement these ideas and who to talk to on the government level.,I think the first part were we all went into the large room was a little wasteful of time since it caused us to start 30 minutes after it was supposed to start,"I took it because it is a pre requisite for my major, I also enjoy learning about politics since it is a big part of our country"
11/7/2022 13:07,11/7/2022 13:13,IP Address,98.208.43.173,100,387,TRUE,11/7/2022 13:13,R_3MtgyYDzm4Koqdm,,,,,39.8068,-121.867,anonymous,EN,I am 18-years of age or older and I agree to take this survey.,11018957,11018957,Healthcare Policy,Agree,Disagree,Agree,Agree,Strongly disagree,Disagree,"The town hall meeting is a good idea in theory but not all college students are interested in politics so they half-ass the work. So when you have groups with people who did the work and others who didn't it creates this environment where no one wants to discuss. What was worse is that the moderators tried making everyone to talk which created a tension since some didn't wanna talk. Over it was very disorganized and overall I felt it was a waste of my time as I didn't really learn anything other than insulin costs too much, we need affordable healthcare, and that the VA needs to be improved. You asked what it means and this is my honest answer but thank you for listening.",I have said all I have needed to say in the previous textbox.,I took this class because it qualified for one of my general education courses
11/7/2022 13:36,11/7/2022 13:41,IP Address,132.241.174.27,100,303,TRUE,11/7/2022 13:41,R_21hPsvAaRDiRgnT,,,,,39.7458,-121.8444,anonymous,EN,I am 18-years of age or older and I agree to take this survey.,11185643,11185643,Healthcare Policy,Strongly Agree,Strongly Agree,Strongly Agree,Strongly Agree,Agree,Agree,Town Hall was an opportunity for me to bring light to political issues I am passionate about while being able to grow my own ideas based off of the ideas of others.,"The sign in process was not organized. There were not enough seats for everyone to participate in the final town hall activity. 
",POLS 155 is a requirement. I don't think I was aware the Town Hall section was included.
11/7/2022 13:42,11/7/2022 13:49,IP Address,132.241.174.24,100,401,TRUE,11/7/2022 13:49,R_DCrevMu8MSxDe4V,,,,,39.7458,-121.8444,anonymous,EN,I am 18-years of age or older and I agree to take this survey.,11695308,11695308,Reproductive Health Policy,Disagree,Disagree,Disagree,Strongly Agree,Strongly disagree,Strongly disagree,"It was inconvenient and could have been a zoom meeting. I am immunocompromised and it was unnerving to be in that large of an unmasked crowd and I was required to be there so I couldn't do anything about it. It also was useless because I didn't learn anything new and the groups were by topic so everyone else had the same research as you. It was also late and inconvenient for those that live off campus, I had to take the bus there and back and it ran so late that I didn't get home until 9:45 which is not ideal for a school required event. It also seemed like busy work and was not anything innovative in terms of ways to facilitate actionable change. ",Make it a zoom session. ,Because it was required.
11/7/2022 14:03,11/7/2022 14:05,IP Address,132.241.174.225,100,135,TRUE,11/7/2022 14:05,R_3q8tlUFqRukpDJA,,,,,39.7458,-121.8444,anonymous,EN,I am 18-years of age or older and I agree to take this survey.,11482225,11482225,Climate Change and Environmental Policy,Agree,Strongly Agree,Agree,Agree,Agree,Agree,,Line before entering ,Mandatory
11/7/2022 14:03,11/7/2022 14:08,IP Address,132.241.174.176,100,250,TRUE,11/7/2022 14:08,R_24BG3hGbsSkk0Ne,,,,,39.7458,-121.8444,anonymous,EN,I am 18-years of age or older and I agree to take this survey.,11405525,11405525,Housing and Homelessness Policy,Strongly Agree,Agree,Strongly Agree,Strongly Agree,Strongly Agree,Strongly Agree,I loved getting to connect to the consultants and other members of the community that shared my passion in my policy group!,The organization of check in could be improved drastically. Possibly by just having people come at different times based on last name rather than expecting hundreds of students to come at the same time and know where they're supposed to go. ,My advisor recommended it. 
11/7/2022 14:26,11/7/2022 14:31,IP Address,132.241.174.230,100,264,TRUE,11/7/2022 14:31,R_3LeaAu2Rx317nVb,,,,,39.7458,-121.8444,anonymous,EN,I am 18-years of age or older and I agree to take this survey.,11440326,11440326,Drug Policy,Agree,Agree,Strongly Agree,Agree,Strongly Agree,Agree,It allowed me to learn a lot about drug related issues in the U.S especially. I had in depth conversations with my peers giving me a new perspective on multiple topics relating to laws and policies on drugs. ,Improving the organization and timeliness of check-in in the begging. ,I took it to further my knowledge on government. 
11/7/2022 14:31,11/7/2022 14:35,IP Address,132.241.174.223,100,233,TRUE,11/7/2022 14:35,R_xauIfzNFiiGO8zn,,,,,39.7458,-121.8444,anonymous,EN,I am 18-years of age or older and I agree to take this survey.,11024469,11024469,Housing and Homelessness Policy,Agree,Agree,Agree,Strongly Agree,Agree,Agree,"It was nice to see how my ideas panned out compared to others, and to see that my policy topic was one that generated genuine interest amongst others.","At the end it seemed a little chaotic, maybe limit the amount of people inside the auditorium to those that will fit at tables and then have more people come in as the people who are done are exiting.",I wanted to be able to learn more about the policy topic I chose and a lot of people told me that it was interesting and informative.
11/7/2022 15:17,11/7/2022 15:21,IP Address,132.241.243.247,100,211,TRUE,11/7/2022 15:21,R_3Rg8PM4Iupd5BZv,,,,,39.7272,-121.8129,anonymous,EN,I am 18-years of age or older and I agree to take this survey.,11497370,11497370,Higher Education Policy,Strongly Agree,Agree,Agree,Agree,Disagree,Agree,it was a fun little interactive project. we got to discuses our work in our POLS classes ,better lines for our nametags,policy problems can be worked on even if your not a member of government
11/7/2022 15:40,11/7/2022 15:45,IP Address,132.241.174.110,100,284,TRUE,11/7/2022 15:45,R_3HY7omjRXdroDD0,,,,,37.9269,-122.3313,anonymous,EN,I am 18-years of age or older and I agree to take this survey.,11425870,11425870,Reproductive Health Policy,Agree,Strongly Agree,Strongly Agree,Strongly Agree,Agree,Agree,"I didn't know what doing all that work throughout the semester was for but now that we did Town Hall, I think that all that work was useful and meaningful.",Maybe give us students more of a look at what is going to happen at town hall. I felt very confused and lost a lot of the time. ,It was a GE requirement.
11/7/2022 9:39,11/7/2022 15:59,IP Address,98.51.9.172,100,22779,TRUE,11/7/2022 15:59,R_2wGodWzo5oBC3K6,,,,,38.6226,-121.3885,anonymous,EN,I am 18-years of age or older and I agree to take this survey.,10329138,10329138,Healthcare Policy,Agree,Agree,Strongly Agree,Agree,Agree,Disagree,"I attended purely because I was required, it meant an evening doing some I would rather not have. That being said it could have been worse ","I don't know how feasible it is, but I would have preferred it earlier in the day ",It fit my schedule best.
11/7/2022 16:08,11/7/2022 16:12,IP Address,73.116.111.182,100,241,TRUE,11/7/2022 16:12,R_1HergVTM8RPmzzA,,,,,39.7458,-121.8444,anonymous,EN,I am 18-years of age or older and I agree to take this survey.,10919871,10919871,Climate Change and Environmental Policy,Agree,Strongly Agree,Strongly Agree,Strongly Agree,Strongly Agree,Disagree,It was just helpful on what I should be researching.,Have the coordinators be a lot more educated on what they are supposed to have the students do.,General Ed Required
11/7/2022 16:38,11/7/2022 16:44,IP Address,132.241.174.135,100,323,TRUE,11/7/2022 16:44,R_3ER0f9wBEcK2DEn,,,,,39.7458,-121.8444,anonymous,EN,I am 18-years of age or older and I agree to take this survey.,11440287,11440287,Cost of Living and Poverty Policy,Strongly Agree,Strongly Agree,Strongly Agree,Strongly Agree,Strongly Agree,Strongly Agree,The Town Hall Meeting allowed me to share my ideas and see others perspective on an issue that we all feel strongly about. ,I believe that getting everyone in the doors faster could improve the meeting.,"I took this class because it is a required class.
"
11/7/2022 16:53,11/7/2022 16:56,IP Address,132.241.174.49,100,227,TRUE,11/7/2022 16:56,R_0wHjo8KAazRNjON,,,,,39.7458,-121.8444,anonymous,EN,I am 18-years of age or older and I agree to take this survey.,11746775,11746775,Firearm Policy,Strongly Agree,Strongly Agree,Agree,Strongly Agree,Strongly Agree,Agree,It was a way to collaborate with others on a similar topic and learn a lot from people that are experienced in the field. It was way different than I expected but was a good experience. ,Somehow make the lines move quicker so entry doesn't take as long.,I did not know there were other sections of POLS 155 until now. 
11/7/2022 10:47,11/7/2022 18:21,IP Address,132.241.174.54,100,27222,TRUE,11/7/2022 18:21,R_31RvyLgIjxX93th,,,,,39.7458,-121.8444,anonymous,EN,I am 18-years of age or older and I agree to take this survey.,11473892,11473892,Climate Change and Environmental Policy,Strongly Agree,Agree,Agree,Strongly Agree,Strongly Agree,Agree,I really enjoyed Town Hall and was really nervous about the whole thing but it was very easy to understand and participate in. I felt like it was important for me to experience an outside of the classroom real experience like that. ,Not so late ,Because it was recommended to me by other people and seemed more fun than the other one. 
11/7/2022 18:19,11/7/2022 18:22,IP Address,132.241.174.169,100,189,TRUE,11/7/2022 18:22,R_enzABospwr8qe1X,,,,,39.7458,-121.8444,anonymous,EN,I am 18-years of age or older and I agree to take this survey.,11506795,11506795,Drug Policy,Strongly Agree,Agree,Agree,Strongly Agree,Agree,Disagree,Honestly the town hall just ment passing the class and getting my ideas out there.,,graduation requirement.
11/7/2022 20:29,11/7/2022 20:30,IP Address,12.24.53.132,100,83,TRUE,11/7/2022 20:30,R_2A1ldxDftCCMAro,,,,,33.8242,-117.8434,anonymous,EN,I am 18-years of age or older and I agree to take this survey.,11443264,11443264,"Food, Agriculture, and Animal Policy",Agree,Agree,Agree,Agree,Strongly Agree,Strongly Agree,It was very informative,it was good,for my major
11/7/2022 21:18,11/7/2022 21:21,IP Address,108.76.186.92,100,199,TRUE,11/7/2022 21:21,R_30crONhsjYAALH8,,,,,39.1061,-121.6159,anonymous,EN,I am 18-years of age or older and I agree to take this survey.,11552516,11552516,Climate Change and Environmental Policy,Strongly Agree,Strongly Agree,Strongly Agree,Strongly Agree,Strongly Agree,Strongly Agree,it was a time to showcase what I learned and how I felt about my topic. I enjoyed doing the research and sharing my ideas.,signing in took a long time and we had to be outside in the cold for like 30-40 minutes but that is hard to solve unless there is a virtual sign in and people are given there information prior to THM,it would be a great experience 
11/8/2022 0:00,11/8/2022 0:05,IP Address,76.114.59.94,100,276,TRUE,11/8/2022 0:05,R_2riv1oekyVD5IY1,,,,,39.7272,-121.8129,anonymous,EN,I am 18-years of age or older and I agree to take this survey.,11606557,11606557,Climate Change and Environmental Policy,Strongly Agree,Agree,Disagree,Agree,Disagree,Disagree,"Since I was specific in climate change with wildfire issues, I didn't have many other students to talk to. The ones I did had the same answers as me so it wasn't very productive. The moderators did help though and I overheard them really helping other areas too. I didn't really connect with the action symposium either",More communitee members per class to help diversify the pool of ideas,"It did sound very interesting, but my idea of it was meeting city officials and discussing our policies, not just with each other"
