Start Date,End Date,Response Type,IP Address,Progress,Duration (in seconds),Finished,Recorded Date,Response ID,Recipient Last Name,Recipient First Name,Recipient Email,External Data Reference,Location Latitude,Location Longitude,Distribution Channel,User Language,"Town Hall Survey

Informed Consent


Hello Chico Student:


The following online survey is part of an important university study on how to improve students' experiences at the Town Hall Meeting. It will take approximately 5-10 minutes to complete.






















Taking part in this research is completely voluntary. If you choose to participate in this research, it is very important that you answer the questions as thoughtfully and frankly as possible. All your answers will be kept strictly confidential. You can stop participating at any time without penalty to your grade.
We would also like to emphasize that you will NOT be penalized if you choose to omit answers to some questions on the survey. To record your answers, you must proceed all the way through the end of the survey, even if you choose to omit answers to some questions. In addition, proceeding to the very end of the survey will remove any survey response information from the screen on your computer/device, protecting your privacy. 


Your student ID is being collected so we can match your responses to other important university programs (U-Course, Town Hall Meeting, Great Debate) and demographic information. IDs may be used for statistical analysis alongside other data such a GPA, retention, and graduation rates. Again, your answers are strictly confidential, and we are bound by rules of this University to maintain this confidentiality. Your information collected as part of this research will be stored on a password protected computer in a locked office within the First-Experience Program office and on a protected server that is located behind a secure firewall at the University Office for Institutional Research. You must be 18-years of age or older to take this survey.


Thank you for filling out this survey as completely and honestly as you can. We are asking you to do this because we value your experience and ideas about how to improve students' experiences here at Chico State.


If you'd like more information about this project, contact the First-Year Experience Program office at fye@csuchico.edu or (530) 898-3705.",Please enter your student ID number. 9 digit number on your student ID. Make sure this is correct to get credit for the survey.,Please re-enter your student ID number. 9 digit number on your student ID. Make sure this is correct to get credit for the survey.,What was your policy area or expertise?,The moderators effectively facilitated the discussion.,"The
students seemed well prepared for the discussion.","The
discussion among all participants was productive.","The consultants contributed effectively to
the conversation.","The
Town Hall Meeting is useful for sharing student ideas and involving campus and
community members in a discussion of those ideas.","I
would recommend the Town Hall Meeting next semester to others.",What did the Town Hall Meeting mean to you?,What could be improved to make the Town Hall Meeting better?,Why did you take a Town Hall Section of POLS 155?
11/1/2022 11:34,11/1/2022 11:36,IP Address,132.241.17.191,100,106,TRUE,11/1/2022 11:36,R_2qDbFr5xr6hFPcT,,,,,39.7458,-121.8444,anonymous,EN,I am 18-years of age or older and I agree to take this survey.,0,0,,,,,,,,,,
11/3/2022 22:41,11/3/2022 22:43,IP Address,132.241.174.52,100,91,TRUE,11/3/2022 22:43,R_3qWLfr2zhiJJW7s,,,,,39.7458,-121.8444,anonymous,EN,I am 18-years of age or older and I agree to take this survey.,11638823,11638823,Climate Change and Environmental Policy,Agree,Agree,Strongly Agree,Agree,Agree,Agree,It was a place to see if I’m on the right track,The entrance time,I didn’t know I did
11/3/2022 22:44,11/3/2022 22:45,IP Address,73.116.73.170,100,105,TRUE,11/3/2022 22:45,R_ysBkbvONxP7JrMd,,,,,39.8068,-121.867,anonymous,EN,I am 18-years of age or older and I agree to take this survey.,8389005,8389005,Firearm Policy,Strongly Agree,Agree,Agree,Agree,Strongly Agree,Strongly Agree,It was cool meeting other people who are working on the same stuff as me,Start on time,I didn’t know there was an option without it
11/3/2022 22:44,11/3/2022 22:46,IP Address,73.235.18.105,100,115,TRUE,11/3/2022 22:46,R_1MW1ngz1IzS3amS,,,,,39.8068,-121.867,anonymous,EN,I am 18-years of age or older and I agree to take this survey.,11376938,11376938,,Strongly Agree,Strongly Agree,Strongly Agree,Strongly Agree,Strongly Agree,Strongly Agree,I learned much more about agriculture and water problems/solutions. ,The check-in process could have a different allotted time. ,I truthfully didn’t know it had Town Hall. 
11/3/2022 22:45,11/3/2022 22:47,IP Address,107.127.14.41,100,105,TRUE,11/3/2022 22:47,R_1dyNqUuxZQn9Dql,,,,,37.6736,-122.0944,anonymous,EN,I am 18-years of age or older and I agree to take this survey.,11377848,11377848,Cost of Living and Poverty Policy,Strongly Agree,Strongly Agree,Strongly Agree,Strongly Agree,Strongly Agree,Strongly Agree,I really enjoyed the comfort I felt in explaining my solution and talking with professionals and getting their opinions. , Better efficiency with signing in,I thought it sounded fun
11/3/2022 22:45,11/3/2022 22:47,IP Address,132.241.174.18,100,127,TRUE,11/3/2022 22:47,R_1gU4XTFqf4rNu8F,,,,,39.7458,-121.8444,anonymous,EN,I am 18-years of age or older and I agree to take this survey.,11713924,11713924,Immigration Policy,Strongly Agree,Agree,Agree,Agree,Agree,Disagree,it was a meeting where i got to meet other people in my policy area ,time management and lines,because i was intrested in town hall
11/3/2022 22:46,11/3/2022 22:47,IP Address,172.58.36.102,100,102,TRUE,11/3/2022 22:47,R_tS7ekXwfBcxTOWl,,,,,38.4799,-121.4451,anonymous,EN,I am 18-years of age or older and I agree to take this survey.,10431643,10431643,Climate Change and Environmental Policy,Strongly Agree,Strongly Agree,Strongly Agree,Strongly Agree,Strongly Agree,Strongly Agree,It was great to learn about other students ideas on my policy ,More volunteers ,I was interested in it 
11/3/2022 22:46,11/3/2022 22:47,IP Address,107.77.212.102,100,97,TRUE,11/3/2022 22:47,R_2QEanAQZseduftU,,,,,37.8994,-122.1144,anonymous,EN,I am 18-years of age or older and I agree to take this survey.,10231781,10231781,,Agree,Agree,Agree,Agree,Agree,Agree,Sharing ideas to change the world ,Faster sign in,It was a requirement 
11/3/2022 22:44,11/3/2022 22:48,IP Address,73.235.32.106,100,235,TRUE,11/3/2022 22:48,R_12MhxDijusx1zyJ,,,,,39.8068,-121.867,anonymous,EN,I am 18-years of age or older and I agree to take this survey.,11695048,11695048,Drug Policy,Agree,Agree,Agree,Agree,Agree,Disagree,It meant sharing the policy I've been focused on to my peers and respected adults in my community. ,"Better organized, I felt disappointed in how unsmoothly it ran for me and my room. We weren't sure what was really happening along with we didn't receive the worksheet necessary at the first breakout. I was just confused. ",Because it is fulfilled credits I needed and I had positive feedback from friends who had taken the course. 
11/3/2022 22:45,11/3/2022 22:49,IP Address,73.66.23.95,100,229,TRUE,11/3/2022 22:49,R_zUQQJmk4d63mI7v,,,,,39.8068,-121.867,anonymous,EN,I am 18-years of age or older and I agree to take this survey.,11076482,11076482,Drug Policy,Strongly Agree,Strongly Agree,Strongly Agree,Strongly Agree,Strongly Agree,Strongly Agree,The town hall meeting was a great opportunity to meet like minded people that had similar thoughts on the same issues.,A bit more organization at the entrance of the meeting would have been nice.,I did not really have a reason behind doing so. 
11/3/2022 22:44,11/3/2022 22:49,IP Address,132.241.174.50,100,294,TRUE,11/3/2022 22:49,R_eu0onjd3WufShvX,,,,,39.7458,-121.8444,anonymous,EN,I am 18-years of age or older and I agree to take this survey.,11449556,11449556,Healthcare Policy,Agree,Strongly Agree,Agree,Strongly Agree,Agree,Agree,It was a place to hear first hand the different approaches to a fixed problem. It was really helpful to hear all the different ways people thought of a solution and it even had me rethinking my approach.,"More time management, we went a bit off schedule  ",Seemed new and fun
11/3/2022 22:46,11/3/2022 22:49,IP Address,73.220.194.200,100,228,TRUE,11/3/2022 22:49,R_yF71mKykUqQ5hi9,,,,,39.8068,-121.867,anonymous,EN,I am 18-years of age or older and I agree to take this survey.,11083333,11083333,Cost of Living and Poverty Policy,Strongly Agree,Strongly Agree,Strongly Agree,Strongly Agree,Strongly Agree,Agree,It was a sharing of ideas,I don’t know what happened at the beginning with getting people in and starting late but that was the only issue I really saw.,To be completely honest I did not know that I did but I am glad I had.
11/3/2022 22:44,11/3/2022 22:50,IP Address,98.208.44.190,100,313,TRUE,11/3/2022 22:50,R_1joKgs6fRasU2d1,,,,,39.8068,-121.867,anonymous,EN,I am 18-years of age or older and I agree to take this survey.,11362963,11362963,Reproductive Health Policy,Strongly Agree,Strongly Agree,Strongly Agree,Strongly Agree,Strongly Agree,Strongly Agree,It was a fun experience sharing ideas about important issues with people that care as much as I do. ,I’m honestly not sure. It was a good experience. ,I switched in last minute. 
11/3/2022 22:44,11/3/2022 22:50,IP Address,98.208.17.127,100,342,TRUE,11/3/2022 22:50,R_1QsU1cwvyxObyEW,,,,,39.7458,-121.8444,anonymous,EN,I am 18-years of age or older and I agree to take this survey.,11080460,11080460,Climate Change and Environmental Policy,Strongly Agree,Strongly Agree,Strongly Agree,Strongly Agree,Strongly Agree,Strongly Agree,Nothing at first. I now see it as a way for people to be able to critique my policy solution and help make it better.,A more organized way to get your name tag. More cookies!,It fulfilled a GE requirement.
11/3/2022 22:46,11/3/2022 22:50,IP Address,98.208.20.167,100,231,TRUE,11/3/2022 22:50,R_piUz3zw1IEwWxdD,,,,,39.8068,-121.867,anonymous,EN,I am 18-years of age or older and I agree to take this survey.,10972287,10972287,Immigration Policy,Agree,Agree,Agree,Strongly Agree,Strongly Agree,Agree,i had to educate myself about all the problems in my policy ,A little more organized ,It was part of my grade
11/3/2022 22:44,11/3/2022 22:50,IP Address,98.208.103.1,100,345,TRUE,11/3/2022 22:50,R_3qV8fdx95whzZn6,,,,,39.7272,-121.8129,anonymous,EN,I am 18-years of age or older and I agree to take this survey.,10620832,10620832,Climate Change and Environmental Policy,Strongly Agree,Strongly Agree,Strongly Agree,Strongly Agree,Strongly Agree,Strongly Agree,"I was able to learn a lot within my policy, and it brought new ideas and allowed me to see how my thinking was relatively the same to others. It made me feel like I was actually contributing and not just working on something the whole semester for it to be a grade. So it meant a lot, it was a fun experience, I wish I could have heard a little from other policy groups, but overall it was good. Also wish it wasn’t so late though. ","Definitely the time, I know it’s hard to get a suitable time but it was late and it was very dark and a lot of people have to walk home. Also maybe for the sign in make it a QR code that when you register in, you get information on where to go? Or maybe be told where to go before hand so you only have to sign in with a QR code? That way everyone is seated inside and we can probably even start sooner. ","I took this class as it was a requirement for GE. It also seemed like it would be more interesting than the other classes listed. I like the town hall idea, it was new and made us involved with the area. I wish more schools where I’m from did this and maybe we would have better things in the area."
11/3/2022 22:47,11/3/2022 22:51,IP Address,50.216.25.74,100,195,TRUE,11/3/2022 22:51,R_3O0w0cdIbJoTmsY,,,,,39.7272,-121.8129,anonymous,EN,I am 18-years of age or older and I agree to take this survey.,11074844,11074844,,Agree,Strongly Agree,Strongly Agree,Agree,Agree,Agree,"Town Hall Meeting was a place where we got to discuss our ideas with other people in that same policy area, it really got me thinking about other issues that we have.",I think the longest part was waiting in line so maybe having more tables for students to sign into.,I took it because I wanted to learn more about how I can contribute to making bills on issues I am passionate about.
11/3/2022 22:47,11/3/2022 22:51,IP Address,132.241.174.149,100,248,TRUE,11/3/2022 22:51,R_56WCdR0fiacmt57,,,,,39.7458,-121.8444,anonymous,EN,I am 18-years of age or older and I agree to take this survey.,11145967,11145967,Healthcare Policy,Agree,Agree,Agree,Strongly Agree,Agree,Agree,It reinforced the idea that we all have a voice in what goes on in our community.,I would say the beginning of the event could be improved such as the students lining up and getting started on time.,It fit into my schedule and thought it was different from normal format of a class.
11/3/2022 22:49,11/3/2022 22:52,IP Address,73.220.199.60,100,172,TRUE,11/3/2022 22:52,R_2pQXom3M6MTvG1Y,,,,,39.7272,-121.8129,anonymous,EN,I am 18-years of age or older and I agree to take this survey.,11039653,11039653,Immigration Policy,Strongly Agree,Agree,Agree,Strongly Agree,Strongly Agree,Agree,"Doing research about your policy individually and having your own opinions on what needs to change is one thing, but conversing with others who may or may not have the same views completely opens your mind to other solutions and possibilities and town hall made that possible. ",Make it possible to converse with more policy groups outside your own. ,"Ge at first, but find it very interesting. "
11/3/2022 22:44,11/3/2022 22:53,IP Address,199.48.116.70,100,546,TRUE,11/3/2022 22:53,R_2V2Ul185HcvpwFU,,,,,39.7458,-121.8444,anonymous,EN,I am 18-years of age or older and I agree to take this survey.,11701340,11701340,Healthcare Policy,Strongly Agree,Strongly Agree,Strongly Agree,Strongly Agree,Strongly Agree,Strongly Agree,"It was definitely an eye opening experience as to how I can get involved in making a difference. It was also super interesting to hear everyone else’s stances and solutions. I had a very good, interactive conversation with people I enjoyed the whole experience!",Nothing I can think of. I liked it!,My roommate took the Town Hall Section of POLS and said that it was a good experience 
11/3/2022 22:49,11/3/2022 22:54,IP Address,67.166.156.38,100,255,TRUE,11/3/2022 22:54,R_2Ehi8LpyDAeciAF,,,,,39.7458,-121.8444,anonymous,EN,I am 18-years of age or older and I agree to take this survey.,11648144,11648144,Firearm Policy,Agree,Agree,Agree,Agree,Agree,Strongly Agree,It got me out of my comfort zone and I was able to speak my opinion while hearing others and understand different people's point of view.,"Nothing everything was great I really liked it.
","besides being part of my GE requirement, I picked it because it looked interesting to me and I was right. Being able to learn different policy area that I didn't know about and learning more about the government. "
11/3/2022 22:52,11/3/2022 22:55,IP Address,73.12.167.247,100,216,TRUE,11/3/2022 22:55,R_2f9vqbTw5ykDhET,,,,,39.508,-121.4571,anonymous,EN,I am 18-years of age or older and I agree to take this survey.,6327270,6327270,Healthcare Policy,Strongly Agree,Agree,Strongly Agree,Agree,Strongly Agree,Strongly Agree,"opening your view point of your subject, not going to lie I felt that I really knowledgable in my policy area until I heard my speakers experience. Hearing from other people with real world experience really opened up a dialogue between us. ","just the timing and the ending, it felt like it was a scramble to leave and I didn't really get to ask all the questions i wanted to",Graduation requirement
11/3/2022 22:54,11/3/2022 22:56,IP Address,132.241.174.75,100,138,TRUE,11/3/2022 22:56,R_3dKXDIjeWZCVZ0X,,,,,39.7272,-121.8129,anonymous,EN,I am 18-years of age or older and I agree to take this survey.,11570001,11570001,Firearm Policy,Agree,Agree,Agree,Agree,Agree,Disagree,It was an interesting experience to see the approach others took to the same policy.,The sign in could be vastly improved.,"I cannot comprehend this question
"
11/3/2022 22:49,11/3/2022 22:57,IP Address,98.208.20.167,100,460,TRUE,11/3/2022 22:57,R_2ZTBIi41p4rUjQU,,,,,39.8068,-121.867,anonymous,EN,I am 18-years of age or older and I agree to take this survey.,10732125,10732125,Immigration Policy,Strongly Agree,Strongly Agree,Strongly Agree,Agree,Strongly Agree,Strongly Agree,To me it at first I didn’t expect much but now realize after this that this is an important thing everyone should go because this experience opens up your mind and you can make a change by attending this.,I believe organizations was the only thing that needs to be improved.,When enrolling into classes I had upperclassmen telling me this is a good course because you leave with knowledge about something specific and you get to really learn about.
11/3/2022 22:53,11/3/2022 22:58,IP Address,98.208.17.127,100,286,TRUE,11/3/2022 22:58,R_11jPULTP9kqbEVs,,,,,39.7458,-121.8444,anonymous,EN,I am 18-years of age or older and I agree to take this survey.,11546367,11546367,Climate Change and Environmental Policy,Strongly Agree,Strongly Agree,Agree,Agree,Agree,Strongly Agree,"(I chose climate change because there was no previous option for agriculture food and animal policy)
Town Hall was a great and fun event for me to attend. It was very straightforward and nothing dragged on. It was a great way to connect with other students with similar policies.","My experience was great, the only thing I would recommend is section out lines more efficiently next time",I don't understand the question but I suppose I chose POLS 155 to fulfill a GE of mine.
11/3/2022 22:50,11/3/2022 22:58,IP Address,73.116.75.52,100,496,TRUE,11/3/2022 22:58,R_6FOhhC49bTYMgHT,,,,,39.7458,-121.8444,anonymous,EN,I am 18-years of age or older and I agree to take this survey.,11473502,11473502,Immigration Policy,Strongly Agree,Agree,Agree,Agree,Agree,Agree,To me Town Hall Meeting provided a space for me to share my ideas and opinions on a topic that is very important to me and I really appreciated that.,I think the biggest issue was definitely timing. I would've liked for the sign in process to go faster but I understand the difficulty of that when there's so many students. I would've also liked the tables to be bigger at the symposium section because it was difficult to engage with the individuals who were sharing/explaining. ,"In all honesty when I signed up for classes it was overwhelming as this is my first year in college and I was mainly focused on creating a schedule that worked out and therefore I didn't really notice there was a Town Hall activity. However, as it turns out I am actually glad I chose this section because I enjoyed the experience. "
11/3/2022 22:58,11/3/2022 23:01,IP Address,98.255.113.119,100,197,TRUE,11/3/2022 23:01,R_3g5TqZEulIIsAaj,,,,,39.8068,-121.867,anonymous,EN,I am 18-years of age or older and I agree to take this survey.,10976278,10976278,Drug Policy,Strongly Agree,Strongly Agree,Strongly Agree,Strongly Agree,Strongly Agree,Agree,"At the beginning of the project, narrowing the focus down from the broad topic of drug policy was tough. So I liked hearing how each person chose to take on the assignment and to see where their kind went when they thought about the drug policy","Once we finished the small flips and went into the BMU for activities, there was nobody who directed us where to go so it was a little confusing. Other than that it was great",I actually didn’t realize that I would be doing the THM but now that it is over I am glad that I did it
11/3/2022 22:59,11/3/2022 23:01,IP Address,132.241.174.14,100,124,TRUE,11/3/2022 23:01,R_2PvY3SrdXiKRJf8,,,,,39.7458,-121.8444,anonymous,EN,I am 18-years of age or older and I agree to take this survey.,11653760,11653760,Immigration Policy,Agree,Strongly Agree,Strongly Agree,Agree,Strongly Agree,Strongly Agree,It meant a lot as I got to hear how other students think.,N/A,Because I wanted to enhance into the city of Chico
11/3/2022 22:49,11/3/2022 23:02,IP Address,71.195.162.89,100,739,TRUE,11/3/2022 23:02,R_qUPTUFQHYoOx7nX,,,,,39.8068,-121.867,anonymous,EN,I am 18-years of age or older and I agree to take this survey.,11038288,11038288,Reproductive Health Policy,Strongly Agree,Strongly Agree,Strongly Agree,Strongly Agree,Strongly Agree,Strongly Agree,"I loved what the moderator and the other adults had to say with my policy topic. Getting into smaller groups really helped get conversations started and the energy was overall positive. Even though there were some disagreements, the energy of the room was focused and well rounded. ",Tell people to come earlier so we could have more time in the discussion rooms and not wait in the lines outside for as long.,As a GE requirement and I wanted to take the class with the town hall experience 
11/3/2022 22:59,11/3/2022 23:02,IP Address,132.241.174.81,100,203,TRUE,11/3/2022 23:02,R_1iew55BEYLhomyD,,,,,39.7272,-121.8129,anonymous,EN,I am 18-years of age or older and I agree to take this survey.,11014732,11014732,Housing and Homelessness Policy,Agree,Agree,,Strongly Agree,Agree,Agree,That it was a important thing to do because not everyone is going to help but having a time to discuss things and see others involved knows that we all have something we are fighting for ,Nothing,Because I need to take it 
11/3/2022 22:50,11/3/2022 23:02,IP Address,73.116.239.231,100,745,TRUE,11/3/2022 23:02,R_3qmvMYKAyND6kRa,,,,,39.7272,-121.8129,anonymous,EN,I am 18-years of age or older and I agree to take this survey.,11491650,11491650,Drug Policy,Strongly Agree,Agree,Strongly Agree,Agree,Strongly Agree,Agree,"The Town Hall Meeting to me was a place for students to all join together to converse over the policy areas we chose and the change we wanted to see in them. It was a productive meeting to share the policy problems we focused on, the solutions we proposed and argued for, and discuss more in detail the actions needed to be taken and the obstacles we might experience for that solution. It helped to create more ideas and outside factors to put more consideration into.","I think the organization at the beginning and end could be a little better. The lines were a little confusing while waiting to sign in and get our name tags which affected the time limits we had. At the end (during the Action Symposium) the tables and areas around them were somewhat overcrowded which made it difficult to focus/participate in the small group discussions with the action tables. Besides this, I believe everything else about the meeting was pretty productive and effective.","I took this class as a chance to get more involved in my community. It also allowed me to be more updated and aware of the policy actions going on in the U.S. currently. It educated me a lot better on our government and the actions they take, as well as the actions we can take, to create change in our societies."
11/3/2022 23:02,11/3/2022 23:05,IP Address,132.241.174.69,100,136,TRUE,11/3/2022 23:05,R_1E59UhwlUbLlESf,,,,,39.7272,-121.8129,anonymous,EN,I am 18-years of age or older and I agree to take this survey.,11372557,11372557,Cost of Living and Poverty Policy,Strongly Agree,Strongly Agree,Agree,Strongly Agree,Strongly Agree,Strongly Agree,We learned how to enact our policy solution I the real world,More efficient check in process,It is a requirement to graduate
11/3/2022 23:03,11/3/2022 23:07,IP Address,174.208.167.60,100,216,TRUE,11/3/2022 23:07,R_1FFgJPW4NNG8Cup,,,,,38.4819,-121.4024,anonymous,EN,I am 18-years of age or older and I agree to take this survey.,10946391,10946391,Cost of Living and Poverty Policy,Strongly Agree,Strongly Agree,Strongly Agree,Strongly Agree,Strongly Agree,Agree,It was great to be able to hear from the advisors who were knowledgeable of the subject and ask them questions. ,We did have extra time in our group after we covered our policy and solutions. We just ended up talking and getting to know each other which was also good. ,It seemed interesting and filled the criteria
11/3/2022 22:59,11/3/2022 23:08,IP Address,98.208.42.217,100,509,TRUE,11/3/2022 23:08,R_3FOsCyGGn3B8iuD,,,,,39.8068,-121.867,anonymous,EN,I am 18-years of age or older and I agree to take this survey.,11029968,11029968,Reproductive Health Policy,Strongly Agree,Strongly Agree,Strongly Agree,Strongly Agree,Strongly Agree,Disagree,The town hall meeting was interesting to see the diversity of opinions and see the intricate research students put into their research,I think the meeting should be shorter and only be amongst each individual class because it will improve organization.,"I didn't know it was a town hall section when I enrolled, however I liked the experience because it was new."
